{
  "conflicts": [],
  "grammar": {
    "name": "Lr",
    "nonterminals": [
      {
        "id": 0,
        "name": "Grammar"
      },
      {
        "id": 1,
        "name": "RuleList"
      },
      {
        "id": 2,
        "name": "Rule"
      },
      {
        "id": 3,
        "name": "Body"
      },
      {
        "id": 4,
        "name": "AltTail"
      },
      {
        "id": 5,
        "name": "Alt"
      },
      {
        "id": 6,
        "name": "SymList"
      },
      {
        "id": 7,
        "name": "Sym"
      },
      {
        "id": 8,
        "name": "Action"
      },
      {
        "id": 9,
        "name": "Label"
      }
    ],
    "precedence": [],
    "rules": [
      {
        "actions": {
          "purescript": "\\rs -> Grammar rs"
        },
        "id": 0,
        "lhs": 0,
        "rhs": [
          {
            "id": 1,
            "ref": "nt"
          }
        ]
      },
      {
        "actions": {
          "purescript": "\\r -> [r]"
        },
        "id": 1,
        "lhs": 1,
        "rhs": [
          {
            "id": 2,
            "ref": "nt"
          }
        ]
      },
      {
        "actions": {
          "purescript": "\\rs r -> snoc rs r"
        },
        "id": 2,
        "lhs": 1,
        "rhs": [
          {
            "id": 1,
            "ref": "nt"
          },
          {
            "id": 2,
            "ref": "nt"
          }
        ]
      },
      {
        "actions": {
          "purescript": "\\lhs _ alts -> Rule lhs alts"
        },
        "id": 3,
        "lhs": 2,
        "rhs": [
          {
            "id": 2,
            "ref": "t"
          },
          {
            "id": 4,
            "ref": "t"
          },
          {
            "id": 3,
            "ref": "nt"
          }
        ]
      },
      {
        "actions": {
          "purescript": "\\_ a as -> cons a as"
        },
        "id": 4,
        "lhs": 3,
        "rhs": [
          {
            "id": 0,
            "ref": "t"
          },
          {
            "id": 5,
            "ref": "nt"
          },
          {
            "id": 4,
            "ref": "nt"
          }
        ]
      },
      {
        "actions": {
          "purescript": "\\_ -> []"
        },
        "id": 5,
        "lhs": 4,
        "rhs": [
          {
            "id": 4,
            "ref": "t"
          }
        ]
      },
      {
        "actions": {
          "purescript": "\\_ _ a as -> cons a as"
        },
        "id": 6,
        "lhs": 4,
        "rhs": [
          {
            "id": 4,
            "ref": "t"
          },
          {
            "id": 6,
            "ref": "t"
          },
          {
            "id": 5,
            "ref": "nt"
          },
          {
            "id": 4,
            "ref": "nt"
          }
        ]
      },
      {
        "actions": {
          "purescript": "\\syms lbl act -> Alt syms lbl act"
        },
        "id": 7,
        "lhs": 5,
        "rhs": [
          {
            "id": 6,
            "ref": "nt"
          },
          {
            "id": 9,
            "ref": "nt"
          },
          {
            "id": 8,
            "ref": "nt"
          }
        ]
      },
      {
        "actions": {
          "purescript": "\\syms lbl -> Alt syms lbl Nothing"
        },
        "id": 8,
        "lhs": 5,
        "rhs": [
          {
            "id": 6,
            "ref": "nt"
          },
          {
            "id": 9,
            "ref": "nt"
          }
        ]
      },
      {
        "actions": {
          "purescript": "\\syms act -> Alt syms Nothing act"
        },
        "id": 9,
        "lhs": 5,
        "rhs": [
          {
            "id": 6,
            "ref": "nt"
          },
          {
            "id": 8,
            "ref": "nt"
          }
        ]
      },
      {
        "actions": {
          "purescript": "\\syms -> Alt syms Nothing Nothing"
        },
        "id": 10,
        "lhs": 5,
        "rhs": [
          {
            "id": 6,
            "ref": "nt"
          }
        ]
      },
      {
        "actions": {
          "purescript": "\\s -> [s]"
        },
        "id": 11,
        "lhs": 6,
        "rhs": [
          {
            "id": 7,
            "ref": "nt"
          }
        ]
      },
      {
        "actions": {
          "purescript": "\\ss s -> snoc ss s"
        },
        "id": 12,
        "lhs": 6,
        "rhs": [
          {
            "id": 6,
            "ref": "nt"
          },
          {
            "id": 7,
            "ref": "nt"
          }
        ]
      },
      {
        "actions": {
          "purescript": "\\i -> Ref i"
        },
        "id": 13,
        "lhs": 7,
        "rhs": [
          {
            "id": 2,
            "ref": "t"
          }
        ]
      },
      {
        "actions": {
          "purescript": "\\t -> Lit t"
        },
        "id": 14,
        "lhs": 7,
        "rhs": [
          {
            "id": 5,
            "ref": "t"
          }
        ]
      },
      {
        "actions": {
          "purescript": "\\a -> Just a"
        },
        "id": 15,
        "lhs": 8,
        "rhs": [
          {
            "id": 1,
            "ref": "t"
          }
        ]
      },
      {
        "actions": {
          "purescript": "\\l -> Just l"
        },
        "id": 16,
        "lhs": 9,
        "rhs": [
          {
            "id": 3,
            "ref": "t"
          }
        ]
      }
    ],
    "start": "Grammar",
    "terminals": [
      {
        "id": 0,
        "kind": "literal",
        "spelling": ":"
      },
      {
        "id": 1,
        "kind": "class",
        "name": "ACTION"
      },
      {
        "id": 2,
        "kind": "class",
        "name": "IDENT"
      },
      {
        "id": 3,
        "kind": "class",
        "name": "LABEL"
      },
      {
        "id": 4,
        "kind": "class",
        "name": "NL"
      },
      {
        "id": 5,
        "kind": "class",
        "name": "TERM_LIT"
      },
      {
        "id": 6,
        "kind": "literal",
        "spelling": "|"
      }
    ]
  },
  "irVersion": 0,
  "tables": {
    "action": [
      {
        "entries": [
          {
            "action": {
              "shift": 4
            },
            "on": {
              "id": 2,
              "ref": "t"
            }
          }
        ],
        "state": 0
      },
      {
        "entries": [
          {
            "action": {
              "accept": true
            },
            "on": {
              "ref": "eof"
            }
          }
        ],
        "state": 1
      },
      {
        "entries": [
          {
            "action": {
              "reduce": 1
            },
            "on": {
              "id": 2,
              "ref": "t"
            }
          },
          {
            "action": {
              "reduce": 1
            },
            "on": {
              "ref": "eof"
            }
          }
        ],
        "state": 2
      },
      {
        "entries": [
          {
            "action": {
              "shift": 4
            },
            "on": {
              "id": 2,
              "ref": "t"
            }
          },
          {
            "action": {
              "reduce": 0
            },
            "on": {
              "ref": "eof"
            }
          }
        ],
        "state": 3
      },
      {
        "entries": [
          {
            "action": {
              "shift": 6
            },
            "on": {
              "id": 4,
              "ref": "t"
            }
          }
        ],
        "state": 4
      },
      {
        "entries": [
          {
            "action": {
              "reduce": 2
            },
            "on": {
              "id": 2,
              "ref": "t"
            }
          },
          {
            "action": {
              "reduce": 2
            },
            "on": {
              "ref": "eof"
            }
          }
        ],
        "state": 5
      },
      {
        "entries": [
          {
            "action": {
              "shift": 8
            },
            "on": {
              "id": 0,
              "ref": "t"
            }
          }
        ],
        "state": 6
      },
      {
        "entries": [
          {
            "action": {
              "reduce": 3
            },
            "on": {
              "id": 2,
              "ref": "t"
            }
          },
          {
            "action": {
              "reduce": 3
            },
            "on": {
              "ref": "eof"
            }
          }
        ],
        "state": 7
      },
      {
        "entries": [
          {
            "action": {
              "shift": 12
            },
            "on": {
              "id": 2,
              "ref": "t"
            }
          },
          {
            "action": {
              "shift": 13
            },
            "on": {
              "id": 5,
              "ref": "t"
            }
          }
        ],
        "state": 8
      },
      {
        "entries": [
          {
            "action": {
              "shift": 15
            },
            "on": {
              "id": 4,
              "ref": "t"
            }
          }
        ],
        "state": 9
      },
      {
        "entries": [
          {
            "action": {
              "reduce": 11
            },
            "on": {
              "id": 1,
              "ref": "t"
            }
          },
          {
            "action": {
              "reduce": 11
            },
            "on": {
              "id": 2,
              "ref": "t"
            }
          },
          {
            "action": {
              "reduce": 11
            },
            "on": {
              "id": 3,
              "ref": "t"
            }
          },
          {
            "action": {
              "reduce": 11
            },
            "on": {
              "id": 4,